fuel_type,installed_capacity_mw,min_stable_generation_pct,heat_rate_mmbtu_per_mwh,variable_om_jpy_mwh,startup_cost_hot_jpy_per_mw,startup_cost_warm_jpy_per_mw,startup_cost_cold_jpy_per_mw,min_up_time_hours,min_down_time_hours,ramp_rate_mw_per_hour,must_run,notes
solar,80000,0.0,0.0,200,0,0,0,0,0,80000,True,Must-take; output = installed_mw * solar_cf from renewable_profiles.csv
wind,5000,0.0,0.0,300,0,0,0,0,0,5000,True,Must-take; output = installed_mw * wind_cf from renewable_profiles.csv
nuclear,10000,0.5,10.5,500,0,0,0,168,168,100,True,~10GW currently operational; treated as constant baseload
hydro,22000,0.0,0.0,500,0,0,0,0,0,11000,False,Dispatchable hydro only (excl pumped storage); near-zero marginal cost
lng_ccgt,65000,0.3,7.0,2000,3000,8000,20000,3,3,1300,False,Most efficient thermal; price setter during many hours
coal,45000,0.4,9.5,1500,5000,15000,40000,6,8,450,False,"Newcastle benchmark; slow ramp, high startup cost"
lng_ocgt,15000,0.2,10.0,2500,1500,4000,10000,1,1,750,False,Fast-start peaker; less efficient than CCGT
oil,15000,0.2,11.0,2000,2000,6000,15000,2,2,600,False,High marginal cost; mainly reserve/peaking use
biomass,5000,0.3,12.0,3000,4000,12000,30000,4,4,150,False,High heat rate; wood pellet / palm kernel shell fuel assumed
